{
  "schema_version": "w1.private.w2-command-dispatch.v1",
  "message_id": "10000000-0000-4000-8000-000000000001",
  "message_type": "w1.private.w2.collection-command.v1",
  "producer": "w1",
  "occurred_at": "2026-09-16T02:00:00Z",
  "visibility_scope": "PRIVATE",
  "payload_schema_version": "w2.collection.v1",
  "payload": {
    "schema_version": "w2.collection.v1",
    "command_id": "10000000-0000-4000-8000-000000000001",
    "job_id": "10000000-0000-4000-8000-000000000002",
    "authenticated_owner_ref": "10000000-0000-4000-8000-000000000003",
    "project_ref": null,
    "company_id": "10000000-0000-4000-8000-000000000004",
    "source_id": "10000000-0000-4000-8000-000000000005",
    "input_version": 1,
    "execution_fence": "1",
    "purpose_ref": "10000000-0000-4000-8000-000000000006",
    "core_source_decision": {
      "is_core": true,
      "decided_by": "w3",
      "rationale": "REQUESTED_ANALYSIS_REQUIRED",
      "decision_revision": 1,
      "analysis_input_version": 1
    },
    "resume_stage": "policy",
    "policy_revision": null,
    "owner_deletion_epoch": 0
  },
  "lookup_request": {
    "schema_version": "w1.private.command-lookup.v1",
    "command_id": "10000000-0000-4000-8000-000000000001",
    "execution_fence": 1,
    "owner_deletion_epoch": 0
  },
  "core_decision_pin": {
    "origin_message_id": "30000000-0000-4000-8000-000000000001",
    "decision_id": "31000000-0000-4000-8000-000000000001",
    "decision_scope": "COMPANY_KNOWLEDGE",
    "company_id": "10000000-0000-4000-8000-000000000004",
    "question_version_id": null,
    "source_id": "10000000-0000-4000-8000-000000000005",
    "analysis_input_version": "company-input:v7",
    "decision_version": 1,
    "is_core": true,
    "decision_code": "CORE_REQUIRED",
    "reason_code": "REQUESTED_ANALYSIS_REQUIRED"
  }
}
